{
 "schema_version": "1.0.0",
 "run_id": "20261026T182815Z-d683f774-001",
 "started_at": "2026-10-26T18:28:15+00:00",
 "finished_at": "2026-10-26T18:28:16+00:00",
 "source_revision": "d683f7745f73a50bb82a6f3763fea1b65106a654",
 "dirty_state": true,
 "host": {
  "os": "Linux 6.17.0-1022-azure",
  "machine": "x86_64"
 },
 "target": "host",
 "worker": "interactive-agent",
 "purpose": "test:TST-M5-UI-TOOL",
 "commands": [
  "python3 -I tests/test_transcript_tool.py"
 ],
 "exit_code": 0,
 "notes": "imported from CI run 40374549305 (verification runner)"
}
