{
 "schema_version": "1.0.0",
 "run_id": "20261018T104734Z-be1d6600-001",
 "started_at": "2026-10-18T10:47:34+00:00",
 "finished_at": "2026-10-18T10:47:38+00:00",
 "source_revision": "be1d6600eeaafb59d3119ddcdf9fc1092106c58c",
 "dirty_state": true,
 "host": {
  "os": "Linux 6.17.0-1022-azure",
  "machine": "x86_64"
 },
 "target": "pc-qemu",
 "worker": "interactive-agent",
 "purpose": "test:TST-M2-PMM-EXHAUST",
 "commands": [
  "qemu-system-x86_64 -machine q35 -cpu qemu64 -m 512M -smp 4 -drive if=pflash,format=raw,readonly=on,file=/usr/share/OVMF/OVMF_CODE_4M.fd -drive if=pflash,format=raw,file=/home/runner/work/nawah-os/nawah-os/build/pc-qemu/OVMF_VARS.fd -drive format=raw,file=fat:rw:/home/runner/work/nawah-os/nawah-os/build/pc-qemu/esp -serial file:/home/runner/work/nawah-os/nawah-os/evidence/20261018T104734Z-be1d6600-001/serial.log -display none -no-reboot -device isa-debug-exit,iobase=0xf4,iosize=0x04 -drive if=none,id=vd0,format=raw,file=/home/runner/work/nawah-os/nawah-os/build/pc-qemu/disk.img -device virtio-blk-pci,drive=vd0,disable-legacy=on,disable-modern=off -fw_cfg name=opt/nawah/test,string=pmm_exhaust"
 ],
 "exit_code": 33
}
