{
 "schema_version": "1.0.0",
 "run_id": "20261028T072338Z-69dfcad0-002",
 "started_at": "2026-10-28T07:23:38+00:00",
 "finished_at": "2026-10-28T07:23:44+00:00",
 "source_revision": "69dfcad0b81ea60f761544144bd38dc254584d0e",
 "dirty_state": true,
 "host": {
  "os": "Linux 6.17.0-1022-azure",
  "machine": "x86_64"
 },
 "target": "virt-qemu-aarch64",
 "worker": "interactive-agent",
 "purpose": "boot",
 "commands": [
  "qemu-system-aarch64 -machine virt -cpu cortex-a57 -m 512M -smp 1 -drive if=pflash,format=raw,readonly=on,file=/usr/share/AAVMF/AAVMF_CODE.fd -drive if=pflash,format=raw,file=/home/runner/work/nawah-os/nawah-os/build/virt-qemu-aarch64/OVMF_VARS.fd -drive format=raw,file=fat:rw:/home/runner/work/nawah-os/nawah-os/build/virt-qemu-aarch64/esp -serial file:/home/runner/work/nawah-os/nawah-os/evidence/20261028T072338Z-69dfcad0-002/serial.log -serial null -display none -no-reboot -semihosting-config enable=on,target=native"
 ],
 "exit_code": 16
}
