{
 "schema_version": "1.0.0",
 "run_id": "20261018T053747Z-e5248c35-001",
 "started_at": "2026-10-18T05:37:47+00:00",
 "finished_at": "2026-10-18T05:37:49+00:00",
 "source_revision": "e5248c358d41e1863c8ee3ab188529a909664599",
 "dirty_state": true,
 "host": {
  "os": "Linux 6.17.0-1022-azure",
  "machine": "x86_64"
 },
 "target": "pc-qemu",
 "worker": "interactive-agent",
 "purpose": "test:TST-M2-EXC-DE",
 "commands": [
  "qemu-system-x86_64 -machine q35 -cpu qemu64 -m 512M -smp 1 -drive if=pflash,format=raw,readonly=on,file=/usr/share/OVMF/OVMF_CODE_4M.fd -drive if=pflash,format=raw,file=/home/runner/work/nawah-os/nawah-os/build/pc-qemu/OVMF_VARS.fd -drive format=raw,file=fat:rw:/home/runner/work/nawah-os/nawah-os/build/pc-qemu/esp -serial file:/home/runner/work/nawah-os/nawah-os/evidence/20261018T053747Z-e5248c35-001/serial.log -display none -no-reboot -device isa-debug-exit,iobase=0xf4,iosize=0x04 -fw_cfg name=opt/nawah/test,string=exc_de"
 ],
 "exit_code": 145
}
