{
 "schema_version": "1.0.0",
 "run_id": "20261018T055146Z-b5101318-001",
 "started_at": "2026-10-18T05:51:46+00:00",
 "finished_at": "2026-10-18T05:51:48+00:00",
 "source_revision": "b51013183551d557090c81bbb4f8d757c63879f7",
 "dirty_state": true,
 "host": {
  "os": "Linux 6.17.0-1022-azure",
  "machine": "x86_64"
 },
 "target": "pc-qemu-e0",
 "worker": "interactive-agent",
 "purpose": "boot",
 "commands": [
  "qemu-system-x86_64 -machine q35 -cpu qemu64 -m 512M -smp 1 -drive if=pflash,format=raw,readonly=on,file=/usr/share/OVMF/OVMF_CODE_4M.fd -drive if=pflash,format=raw,file=/home/runner/work/nawah-os/nawah-os/build/pc-qemu-e0/OVMF_VARS.fd -drive format=raw,file=fat:rw:/home/runner/work/nawah-os/nawah-os/build/pc-qemu-e0/esp -serial file:/home/runner/work/nawah-os/nawah-os/evidence/20261018T055146Z-b5101318-001/serial.log -display none -no-reboot -device isa-debug-exit,iobase=0xf4,iosize=0x04"
 ],
 "exit_code": 33
}
