{
 "schema_version": "1.0.0",
 "run_id": "20261028T050308Z-e772e851-002",
 "started_at": "2026-10-28T05:03:08+00:00",
 "finished_at": "2026-10-28T05:03:09+00:00",
 "source_revision": "e772e851bc43f61db1729df820c6e654d2574041",
 "dirty_state": true,
 "host": {
  "os": "Linux 6.17.0-1022-azure",
  "machine": "x86_64"
 },
 "target": "host",
 "worker": "interactive-agent",
 "purpose": "test:TST-M0-002",
 "commands": [
  "python3 -I tests/test_m0_records.py"
 ],
 "exit_code": 0
}
