{
 "schema_version": "1.0.0",
 "run_id": "20261018T171301Z-de5936c6-001",
 "started_at": "2026-10-18T17:13:01+00:00",
 "finished_at": "2026-10-18T17:13:04+00:00",
 "source_revision": "de5936c638a946bdc430a53b11f5ca9a7e7bafdd",
 "dirty_state": true,
 "host": {
  "os": "Linux 6.17.0-1022-azure",
  "machine": "x86_64"
 },
 "target": "pc-qemu-e0",
 "worker": "interactive-agent",
 "purpose": "build",
 "commands": [
  "clang -target x86_64-unknown-windows -ffreestanding -fshort-wchar -mno-red-zone -fno-stack-protector -fno-builtin -nostdlib -O2 -Wall -Wextra -Werror -DBUILD_ID=de5936c638a9 -c boot/e0/main.c -o /home/runner/work/nawah-os/nawah-os/build/pc-qemu-e0/e0.o",
  "lld-link /subsystem:efi_application /entry:efi_main /nodefaultlib /home/runner/work/nawah-os/nawah-os/build/pc-qemu-e0/e0.o /out:/home/runner/work/nawah-os/nawah-os/build/pc-qemu-e0/E0.EFI"
 ],
 "exit_code": 0
}
