{
 "schema_version": "1.0.0",
 "run_id": "20261019T110406Z-043769ed-001",
 "started_at": "2026-10-19T11:04:06+00:00",
 "finished_at": "2026-10-19T11:04:06+00:00",
 "source_revision": "043769edbaa548118b2b9fdb2e9c34d1358aa5f8",
 "dirty_state": true,
 "host": {
  "os": "Linux 6.17.0-1022-azure",
  "machine": "x86_64"
 },
 "target": "host",
 "worker": "interactive-agent",
 "purpose": "test:TST-M1-NOBS",
 "commands": [
  "python3 -I tests/test_m1_nobs.py"
 ],
 "exit_code": 0
}
