{
 "schema_version": "1.0.0",
 "run_id": "20261025T183542Z-60bb0f62-001",
 "started_at": "2026-10-25T18:35:42+00:00",
 "finished_at": "2026-10-25T18:35:45+00:00",
 "source_revision": "60bb0f62652b82c2f9cb250330f5414ea0f07e6a",
 "dirty_state": true,
 "host": {
  "os": "Linux 6.17.0-1022-azure",
  "machine": "x86_64"
 },
 "target": "host",
 "worker": "interactive-agent",
 "purpose": "test:TST-M5-GLYPHS",
 "commands": [
  "python3 -I tests/test_text.py Glyphs"
 ],
 "exit_code": 0
}
