{
 "schema_version": "1.0.0",
 "run_id": "20261030T163538Z-d45d83fe-001",
 "started_at": "2026-10-30T16:35:38+00:00",
 "finished_at": "2026-10-30T16:35:42+00:00",
 "source_revision": "d45d83fe46bdb5286fda15242f6c6fb8f73fa1e8",
 "dirty_state": true,
 "host": {
  "os": "Linux 7.0.0-1017-azure",
  "machine": "x86_64"
 },
 "target": "host",
 "worker": "interactive-agent",
 "purpose": "test:TST-M4-SHELL-TOOL",
 "commands": [
  "python3 -I tests/test_console_session.py"
 ],
 "exit_code": 0
}
