{
 "schema_version": "1.0.0",
 "run_id": "20261018T232328Z-a54ff66b-001",
 "started_at": "2026-10-18T23:23:28+00:00",
 "finished_at": "2026-10-18T23:23:38+00:00",
 "source_revision": "a54ff66b332ea75c3b76913afaf082c8816a755a",
 "dirty_state": true,
 "host": {
  "os": "Linux 6.17.0-1022-azure",
  "machine": "x86_64"
 },
 "target": "pc-qemu",
 "worker": "interactive-agent",
 "purpose": "test:TST-M4-CONFIG-PERSIST",
 "commands": [
  "qemu-system-x86_64 -machine q35 -cpu qemu64 -m 512M -smp 4 -drive if=pflash,format=raw,readonly=on,file=/usr/share/OVMF/OVMF_CODE_4M.fd -drive if=pflash,format=raw,file=/home/runner/work/nawah-os/nawah-os/build/pc-qemu/OVMF_VARS.fd -drive format=raw,file=fat:rw:/home/runner/work/nawah-os/nawah-os/build/pc-qemu/esp -serial file:/home/runner/work/nawah-os/nawah-os/evidence/20261018T232328Z-a54ff66b-001/serial-1.log -serial null -display none -no-reboot -device isa-debug-exit,iobase=0xf4,iosize=0x04 -drive if=none,id=vd0,format=raw,file=/home/runner/work/nawah-os/nawah-os/build/pc-qemu/disk.img -device virtio-blk-pci,drive=vd0,disable-legacy=on,disable-modern=off -netdev user,id=n0,net=10.0.2.0/24,dhcpstart=10.0.2.15 -device virtio-net-pci,netdev=n0,disable-legacy=on,disable-modern=off -fw_cfg name=opt/nawah/test,string=config_persist_write",
  "qemu-system-x86_64 -machine q35 -cpu qemu64 -m 512M -smp 4 -drive if=pflash,format=raw,readonly=on,file=/usr/share/OVMF/OVMF_CODE_4M.fd -drive if=pflash,format=raw,file=/home/runner/work/nawah-os/nawah-os/build/pc-qemu/OVMF_VARS.fd -drive format=raw,file=fat:rw:/home/runner/work/nawah-os/nawah-os/build/pc-qemu/esp -serial file:/home/runner/work/nawah-os/nawah-os/evidence/20261018T232328Z-a54ff66b-001/serial-2.log -serial null -display none -no-reboot -device isa-debug-exit,iobase=0xf4,iosize=0x04 -drive if=none,id=vd0,format=raw,file=/home/runner/work/nawah-os/nawah-os/build/pc-qemu/disk.img -device virtio-blk-pci,drive=vd0,disable-legacy=on,disable-modern=off -netdev user,id=n0,net=10.0.2.0/24,dhcpstart=10.0.2.15 -device virtio-net-pci,netdev=n0,disable-legacy=on,disable-modern=off -fw_cfg name=opt/nawah/test,string=config_persist_read"
 ],
 "exit_code": 33,
 "notes": "imported from CI run 39175587401 (verification runner)"
}
