{
 "schema_version": "1.0.0",
 "run_id": "20261019T120714Z-c0bec0ee-001",
 "started_at": "2026-10-19T12:07:14+00:00",
 "finished_at": "2026-10-19T12:07:23+00:00",
 "source_revision": "c0bec0ee8722c81e9aa269d8a005eed158724e85",
 "dirty_state": true,
 "host": {
  "os": "Linux 6.17.0-1022-azure",
  "machine": "x86_64"
 },
 "target": "pc-qemu",
 "worker": "interactive-agent",
 "purpose": "test:TST-M4-SHELL-LOGIN",
 "commands": [
  "qemu-system-x86_64 -machine q35 -cpu qemu64 -m 512M -smp 4 -drive if=pflash,format=raw,readonly=on,file=/usr/share/OVMF/OVMF_CODE_4M.fd -drive if=pflash,format=raw,file=/home/runner/work/nawah-os/nawah-os/build/pc-qemu/OVMF_VARS.fd -drive format=raw,file=fat:rw:/home/runner/work/nawah-os/nawah-os/build/pc-qemu/esp -serial file:/home/runner/work/nawah-os/nawah-os/evidence/20261019T120714Z-c0bec0ee-001/serial.log -serial tcp:127.0.0.1:17011,server=on,wait=off -display none -no-reboot -device isa-debug-exit,iobase=0xf4,iosize=0x04 -drive if=none,id=vd0,format=raw,file=/home/runner/work/nawah-os/nawah-os/build/pc-qemu/disk.img -device virtio-blk-pci,drive=vd0,disable-legacy=on,disable-modern=off -netdev user,id=n0,net=10.0.2.0/24,dhcpstart=10.0.2.15 -device virtio-net-pci,netdev=n0,disable-legacy=on,disable-modern=off -fw_cfg name=opt/nawah/test,string=shell_login"
 ],
 "exit_code": 33
}
